level	id	parent_id	object_id	object_type	query_status	query_time	query_type	text	created_time	comment_count	like_count	love_count	haha_count	wow_count	sad_count	angry_count	sentiment	subjectivity	clean_text	tokens_pos
1	517	1	4392439134104944_4392686980746826	data	fetched (200)	2021-02-10	Facebook:/<post-id>/comments	Bescherm u zelf voor uw gezondheid hier een uitleg wat de bijwerkingen zijn van het vaccin omtrend covid 19  Er zijn twee injecties in het Covid19-vaccin van Pfizer. Het eerste shot is acetaminophen, het wordt toegediend om te proberen de ernstige bijwerkingen van het tweede shot, het vaccin, te verlichten.  HIER IS DE FDA-LIJST MET DE ERNSTIG  BIJwerkingen.   Syndroom van Guillain-Barré - immuunsysteem tast zenuwen aan  Acute verspreide encefalomyelitis - ontsteking in de hersenen / ruggenmerg  Transversale myelitis - beschadigt isolerende zenuwcelvezels  Encefalitis - hersenontsteking  Myelitis - ontsteking van het ruggenmerg.  Encefalomyelitis - ontsteking van de hersenen en het ruggenmerg  Meningoencefalitis - herpes  Meningitis - infectie / ontsteking van vloeistof die de hersenen / het ruggenmerg beschermt.  Encefolapathie - schade of ziekte die de hersenen aantast.  Convulsies - oncontroleerbare spiersamentrekkingen  Toevallen - oncontroleerbare spiersamentrekkingen  Beroerte - slechte bloedtoevoer naar de hersenen veroorzaakt celdood Narcolepsie - chronische slaapstoornis, overweldigende slaperigheid overdag  Kataplexie - spieren worden plotseling slap of verzwakken zonder waarschuwing.  Anafylaxie - ernstige levensbedreigende allergische reacties.  Acuut myocardinfarct - hartaanval  Myocarditis - ontsteking van de hartspier  Pericarditis - ontsteking van het hartzakje  Auto-immuunziekte - immuunsysteem valt het lichaam aan.  Uitkomsten van zwangerschap en geboorte - doodgeborenen  Niet-anafylactische allergische reacties - ernstige allergische reacties  Trombocytopenie - beenmergaandoening, leukemie, immuunsysteem  Verspreide intravasculaire coagulatie - abnormale bloedstolling in het lichaam  Veneuze trombo-embolie - bloedstolsels die hartaanvallen veroorzaken Artritis en artralgie - gewrichtspijn  Ziekte van Kawasaki - hoge koorts en vervelling van de huid  Vaccin-versterkte ziekte - Vaccingerelateerde ademhalingsziekte  Multisysteeminflammatoir syndroom bij kinderen - Ontsteking van het hart, de longen, de nieren, de hersenen, de huid, de ogen of de maagdarmorganen.  Dood	2020-12-30	1.0	0.0	0.0	0.0	0.0	0.0	0.0	-0.19374999999999998	0.6656250000000001	bescherm gezondheid uitleg bijwerkingen vaccin omtrend covid 19   twee injecties covid19vaccin pfizer eerste shot acetaminophen toegediend proberen ernstige bijwerkingen tweede shot vaccin verlichten   fdalijst ernstig   bijwerkingen    syndroom guillainbarré   immuunsysteem tast zenuwen   acute verspreide encefalomyelitis   ontsteking hersenen   ruggenmerg   transversale myelitis   beschadigt isolerende zenuwcelvezels   encefalitis   hersenontsteking   myelitis   ontsteking ruggenmerg   encefalomyelitis   ontsteking hersenen ruggenmerg   meningoencefalitis   herpes   meningitis   infectie   ontsteking vloeistof hersenen   ruggenmerg beschermt   encefolapathie   schade ziekte hersenen aantast   convulsies   oncontroleerbare spiersamentrekkingen   toevallen   oncontroleerbare spiersamentrekkingen   beroerte   slechte bloedtoevoer hersenen veroorzaakt celdood narcolepsie   chronische slaapstoornis overweldigende slaperigheid overdag   kataplexie   spieren plotseling slap verzwakken waarschuwing   anafylaxie   ernstige levensbedreigende allergische reacties   acuut myocardinfarct   hartaanval   myocarditis   ontsteking hartspier   pericarditis   ontsteking hartzakje   autoimmuunziekte   immuunsysteem valt lichaam   uitkomsten zwangerschap geboorte   doodgeborenen   nietanafylactische allergische reacties   ernstige allergische reacties   trombocytopenie   beenmergaandoening leukemie immuunsysteem   verspreide intravasculaire coagulatie   abnormale bloedstolling lichaam   veneuze tromboembolie   bloedstolsels hartaanvallen veroorzaken artritis artralgie   gewrichtspijn   ziekte kawasaki   hoge koorts vervelling huid   vaccinversterkte ziekte   vaccingerelateerde ademhalingsziekte   multisysteeminflammatoir syndroom kinderen   ontsteking hart longen nieren hersenen huid ogen maagdarmorganen   dood	[('bescherm', 'AUX'), ('gezondheid', 'NOUN'), ('uitleg', 'NOUN'), ('bijwerkingen', 'NOUN'), ('vaccin', 'NOUN'), ('omtrend', 'ADJ'), ('covid', 'PROPN'), ('19', 'NUM'), (' ', 'SPACE'), ('twee', 'NUM'), ('injecties', 'NOUN'), ('covid19vaccin', 'NOUN'), ('pfizer', 'PROPN'), ('eerste', 'ADJ'), ('shot', 'NOUN'), ('acetaminophen', 'VERB'), ('toegediend', 'VERB'), ('proberen', 'VERB'), ('ernstige', 'ADJ'), ('bijwerkingen', 'NOUN'), ('tweede', 'ADJ'), ('shot', 'NOUN'), ('vaccin', 'NOUN'), ('verlichten', 'VERB'), (' ', 'SPACE'), ('fdalijst', 'NOUN'), ('ernstig', 'ADJ'), (' ', 'SPACE'), ('bijwerkingen', 'AUX'), ('  ', 'SPACE'), ('syndroom', 'NOUN'), ('guillainbarré', 'PROPN'), (' ', 'SPACE'), ('immuunsysteem', 'VERB'), ('tast', 'VERB'), ('zenuwen', 'VERB'), (' ', 'SPACE'), ('acute', 'PROPN'), ('verspreide', 'VERB'), ('encefalomyelitis', 'PROPN'), (' ', 'SPACE'), ('ontsteking', 'NOUN'), ('hersenen', 'NOUN'), (' ', 'SPACE'), ('ruggenmerg', 'PROPN'), (' ', 'SPACE'), ('transversale', 'ADJ'), ('myelitis', 'PROPN'), (' ', 'SPACE'), ('beschadigt', 'AUX'), ('isolerende', 'ADJ'), ('zenuwcelvezels', 'NOUN'), (' ', 'SPACE'), ('encefalitis', 'PROPN'), (' ', 'SPACE'), ('hersenontsteking', 'NOUN'), (' ', 'SPACE'), ('myelitis', 'PROPN'), (' ', 'SPACE'), ('ontsteking', 'NOUN'), ('ruggenmerg', 'NOUN'), (' ', 'SPACE'), ('encefalomyelitis', 'PROPN'), (' ', 'SPACE'), ('ontsteking', 'NOUN'), ('hersenen', 'NOUN'), ('ruggenmerg', 'NOUN'), (' ', 'SPACE'), ('meningoencefalitis', 'PROPN'), (' ', 'SPACE'), ('herpes', 'ADV'), (' ', 'SPACE'), ('meningitis', 'PROPN'), (' ', 'SPACE'), ('infectie', 'NOUN'), (' ', 'SPACE'), ('ontsteking', 'NOUN'), ('vloeistof', 'NOUN'), ('hersenen', 'NOUN'), (' ', 'SPACE'), ('ruggenmerg', 'NOUN'), ('beschermt', 'AUX'), (' ', 'SPACE'), ('encefolapathie', 'PROPN'), (' ', 'SPACE'), ('schade', 'NOUN'), ('ziekte', 'NOUN'), ('hersenen', 'NOUN'), ('aantast', 'VERB'), (' ', 'SPACE'), ('convulsies', 'NOUN'), (' ', 'SPACE'), ('oncontroleerbare', 'ADJ'), ('spiersamentrekkingen', 'NOUN'), (' ', 'SPACE'), ('toevallen', 'NOUN'), (' ', 'SPACE'), ('oncontroleerbare', 'ADJ'), ('spiersamentrekkingen', 'NOUN'), (' ', 'SPACE'), ('beroerte', 'PROPN'), (' ', 'SPACE'), ('slechte', 'ADJ'), ('bloedtoevoer', 'NOUN'), ('hersenen', 'NOUN'), ('veroorzaakt', 'AUX'), ('celdood', 'PROPN'), ('narcolepsie', 'PROPN'), (' ', 'SPACE'), ('chronische', 'ADJ'), ('slaapstoornis', 'NOUN'), ('overweldigende', 'VERB'), ('slaperigheid', 'NOUN'), ('overdag', 'ADV'), (' ', 'SPACE'), ('kataplexie', 'PROPN'), (' ', 'SPACE'), ('spieren', 'VERB'), ('plotseling', 'ADJ'), ('slap', 'NOUN'), ('verzwakken', 'VERB'), ('waarschuwing', 'NOUN'), (' ', 'SPACE'), ('anafylaxie', 'PROPN'), (' ', 'SPACE'), ('ernstige', 'ADJ'), ('levensbedreigende', 'ADJ'), ('allergische', 'ADJ'), ('reacties', 'NOUN'), (' ', 'SPACE'), ('acuut', 'PROPN'), ('myocardinfarct', 'PROPN'), (' ', 'SPACE'), ('hartaanval', 'PROPN'), (' ', 'SPACE'), ('myocarditis', 'PROPN'), (' ', 'SPACE'), ('ontsteking', 'NOUN'), ('hartspier', 'NOUN'), (' ', 'SPACE'), ('pericarditis', 'PROPN'), (' ', 'SPACE'), ('ontsteking', 'NOUN'), ('hartzakje', 'NOUN'), (' ', 'SPACE'), ('autoimmuunziekte', 'AUX'), (' ', 'SPACE'), ('immuunsysteem', 'NOUN'), ('valt', 'AUX'), ('lichaam', 'NOUN'), (' ', 'SPACE'), ('uitkomsten', 'NOUN'), ('zwangerschap', 'NOUN'), ('geboorte', 'NOUN'), (' ', 'SPACE'), ('doodgeborenen', 'AUX'), (' ', 'SPACE'), ('nietanafylactische', 'ADJ'), ('allergische', 'ADJ'), ('reacties', 'NOUN'), (' ', 'SPACE'), ('ernstige', 'ADJ'), ('allergische', 'ADJ'), ('reacties', 'NOUN'), (' ', 'SPACE'), ('trombocytopenie', 'NOUN'), (' ', 'SPACE'), ('beenmergaandoening', 'NOUN'), ('leukemie', 'NOUN'), ('immuunsysteem', 'NOUN'), (' ', 'SPACE'), ('verspreide', 'VERB'), ('intravasculaire', 'ADJ'), ('coagulatie', 'NOUN'), (' ', 'SPACE'), ('abnormale', 'ADJ'), ('bloedstolling', 'NOUN'), ('lichaam', 'NOUN'), (' ', 'SPACE'), ('veneuze', 'ADJ'), ('tromboembolie', 'NOUN'), (' ', 'SPACE'), ('bloedstolsels', 'NOUN'), ('hartaanvallen', 'NOUN'), ('veroorzaken', 'AUX'), ('artritis', 'NOUN'), ('artralgie', 'NOUN'), (' ', 'SPACE'), ('gewrichtspijn', 'VERB'), (' ', 'SPACE'), ('ziekte', 'NOUN'), ('kawasaki', 'PROPN'), (' ', 'SPACE'), ('hoge', 'ADJ'), ('koorts', 'NOUN'), ('vervelling', 'NOUN'), ('huid', 'NOUN'), (' ', 'SPACE'), ('vaccinversterkte', 'VERB'), ('ziekte', 'NOUN'), (' ', 'SPACE'), ('vaccingerelateerde', 'AUX'), ('ademhalingsziekte', 'AUX'), (' ', 'SPACE'), ('multisysteeminflammatoir', 'PROPN'), ('syndroom', 'PROPN'), ('kinderen', 'NOUN'), (' ', 'SPACE'), ('ontsteking', 'NOUN'), ('hart', 'NOUN'), ('longen', 'NOUN'), ('nieren', 'NOUN'), ('hersenen', 'NOUN'), ('huid', 'NOUN'), ('ogen', 'NOUN'), ('maagdarmorganen', 'NOUN'), (' ', 'SPACE'), ('dood', 'ADJ')]
1	518	1	4392439134104944_4392689114079946	data	fetched (200)	2021-02-10	Facebook:/<post-id>/comments	Janny Petersen dat is volledig jouw keuze. Het “moeten” was gericht op het eerder beginnen met vaccineren. 	2020-12-30	0.0	3.0	0.0	0.0	0.0	0.0	0.0	0.05	0.30000000000000004	janny petersen volledig jouw keuze moeten gericht eerder beginnen vaccineren	[('janny', 'PROPN'), ('petersen', 'PROPN'), ('volledig', 'ADJ'), ('jouw', 'PRON'), ('keuze', 'NOUN'), ('moeten', 'VERB'), ('gericht', 'VERB'), ('eerder', 'NOUN'), ('beginnen', 'VERB'), ('vaccineren', 'NOUN')]
1	520	1	4392439134104944_4392690507413140	data	fetched (200)	2021-02-10	Facebook:/<post-id>/comments	Pieter Dacaprio https://m.youtube.com/watch?v=NFo-c1b02Oc&feature=youtu.be	2020-12-30	0.0	2.0	0.0	0.0	0.0	0.0	0.0	0.0	0.0	pieter dacaprio	[('pieter', 'PROPN'), ('dacaprio', 'PROPN')]
1	521	1	4392439134104944_4392694514079406	data	fetched (200)	2021-02-10	Facebook:/<post-id>/comments	Ria Driessen cursus Nederlands voor beginners !	2020-12-30	0.0	1.0	0.0	2.0	0.0	0.0	0.0	0.0	0.0	ria driessen cursus nederlands beginners	[('ria', 'PROPN'), ('driessen', 'PROPN'), ('cursus', 'X'), ('nederlands', 'PROPN'), ('beginners', 'NOUN')]
1	522	1	4392439134104944_4392698457412345	data	fetched (200)	2021-02-10	Facebook:/<post-id>/comments	"Anja Van Beest-van Dien een paar procent noem ik niet ""velen"""	2020-12-30	0.0	2.0	0.0	0.0	0.0	0.0	0.0	0.0	0.0	anja beestvan dien paar procent noem velen	[('anja', 'PROPN'), ('beestvan', 'PROPN'), ('dien', 'PRON'), ('paar', 'NOUN'), ('procent', 'NOUN'), ('noem', 'VERB'), ('velen', 'PRON')]
1	523	1	4392439134104944_4392698907412300	data	fetched (200)	2021-02-10	Facebook:/<post-id>/comments	https://de-ware-wereld.nl/2020/12/28/huisarts-spreekt-zich-uit-over-vaccinatiedwang/?fbclid=IwAR3vBqyZ2khx2wsnPf26ZHFh5daLvG64SZasoAdEJ2KRXxwyCQa3cxNKT7k 	2020-12-30	0.0	0.0	0.0	0.0	0.0	0.0	0.0	0.0	0.0	 	[(' ', 'SPACE')]
1	524	1	4392439134104944_4392698970745627	data	fetched (200)	2021-02-10	Facebook:/<post-id>/comments	"Eens te meer blijkt dat professionals van de werkvloer het allemaal wat beter begrijpen dan een ""minister"" met blitse patas"	2020-12-30	0.0	0.0	0.0	0.0	0.0	0.0	0.0	0.1	0.35	blijkt professionals werkvloer allemaal beter begrijpen minister blitse patas	[('blijkt', 'AUX'), ('professionals', 'NOUN'), ('werkvloer', 'NOUN'), ('allemaal', 'ADV'), ('beter', 'ADJ'), ('begrijpen', 'AUX'), ('minister', 'NOUN'), ('blitse', 'ADJ'), ('patas', 'NOUN')]
1	525	1	4392439134104944_4392703347411856	data	fetched (200)	2021-02-10	Facebook:/<post-id>/comments	Geeft maar aan welk type Nederlander er TEGEN is. Zelf niet heel veel studie gedaan. Of gewoon niets.... Lagere school Nederlandse lessen al vergeten voor het verlaten van de 6e klas basisschool en toch schreeuwen alsof je een boel kennis hebt.   Aan je foto's te zien heb je liever een spatscherm van 1m² voor je gezicht 👍 Ik... begrijp het niet, maar gelukkig heb je dat recht 😉 Geef jij je vaccin maar weg Anne :D 	2020-12-30	0.0	5.0	1.0	0.0	0.0	0.0	0.0	0.37142857142857144	0.7999999999999999	geeft welk type nederlander heel studie gedaan gewoon lagere school nederlandse lessen vergeten verlaten 6e klas basisschool schreeuwen alsof boel kennis hebt    fotos zien liever spatscherm 1 m² gezicht 👍 begrijp gelukkig recht 😉 geef jij vaccin weg anne d	[('geeft', 'AUX'), ('welk', 'DET'), ('type', 'NOUN'), ('nederlander', 'NOUN'), ('heel', 'ADJ'), ('studie', 'NOUN'), ('gedaan', 'VERB'), ('gewoon', 'ADJ'), ('lagere', 'ADJ'), ('school', 'NOUN'), ('nederlandse', 'ADJ'), ('lessen', 'NOUN'), ('vergeten', 'VERB'), ('verlaten', 'AUX'), ('6e', 'ADJ'), ('klas', 'NOUN'), ('basisschool', 'PROPN'), ('schreeuwen', 'VERB'), ('alsof', 'SCONJ'), ('boel', 'NOUN'), ('kennis', 'NOUN'), ('hebt', 'AUX'), ('  ', 'SPACE'), ('fotos', 'AUX'), ('zien', 'VERB'), ('liever', 'ADV'), ('spatscherm', 'NOUN'), ('1', 'NUM'), ('m²', 'DET'), ('gezicht', 'NOUN'), ('👍', 'VERB'), ('begrijp', 'VERB'), ('gelukkig', 'ADJ'), ('recht', 'NOUN'), ('😉', 'NOUN'), ('geef', 'VERB'), ('jij', 'PRON'), ('vaccin', 'NOUN'), ('weg', 'ADV'), ('anne', 'PROPN'), ('d', 'PROPN')]
1	526	1	4392439134104944_4392704577411733	data	fetched (200)	2021-02-10	Facebook:/<post-id>/comments	Marcel Jansen  het moet ervoor zorgen dat verpleegkundigen niet ziek worden en er dus meer bezetting is in de ziekenhuizen. Om de druk naar beneden te krijgen moet je een groot deel van de Nederlandse bevolking enten want ziekenhuisopnames komen onder alle leeftijden voor. Dat gaat nog maanden duren 	2020-12-30	0.0	4.0	0.0	0.0	0.0	0.0	0.0	0.013888888888888931	0.7999999999999999	marcel jansen   ervoor zorgen verpleegkundigen ziek bezetting ziekenhuizen druk beneden krijgen groot deel nederlandse bevolking enten ziekenhuisopnames komen alle leeftijden gaat maanden duren	[('marcel', 'PROPN'), ('jansen', 'PROPN'), (' ', 'SPACE'), ('ervoor', 'ADV'), ('zorgen', 'VERB'), ('verpleegkundigen', 'NOUN'), ('ziek', 'ADJ'), ('bezetting', 'NOUN'), ('ziekenhuizen', 'NOUN'), ('druk', 'NOUN'), ('beneden', 'ADP'), ('krijgen', 'VERB'), ('groot', 'ADJ'), ('deel', 'NOUN'), ('nederlandse', 'ADJ'), ('bevolking', 'NOUN'), ('enten', 'ADJ'), ('ziekenhuisopnames', 'NOUN'), ('komen', 'AUX'), ('alle', 'DET'), ('leeftijden', 'NOUN'), ('gaat', 'AUX'), ('maanden', 'NOUN'), ('duren', 'VERB')]
1	527	1	4392439134104944_4392705464078311	data	fetched (200)	2021-02-10	Facebook:/<post-id>/comments	En gelijk hebben ze.	2020-12-30	0.0	0.0	0.0	0.0	0.0	0.0	0.0	0.05	0.2	gelijk	[('gelijk', 'ADJ')]
1	528	1	4392439134104944_4392706820744842	data	fetched (200)	2021-02-10	Facebook:/<post-id>/comments	Doennnn	2020-12-30	0.0	0.0	0.0	0.0	0.0	0.0	0.0	0.0	0.0	doennnn	[('doennnn', 'PROPN')]
1	529	1	4392439134104944_4392709814077876	data	fetched (200)	2021-02-10	Facebook:/<post-id>/comments	Zo lang mogelijk uitstellen om Nederland naar de kloten te helpen.spuiten en heel hard ingrijpen voor de mensen die niet luisteren. Nieuwe gevangenissen bouwen en de niet luisterende mensen opsluiten 	2020-12-30	0.0	1.0	0.0	0.0	0.0	0.0	0.0	0.012500000000000004	0.6125	lang mogelijk uitstellen nederland kloten helpenspuiten heel hard ingrijpen mensen luisteren nieuwe gevangenissen bouwen luisterende mensen opsluiten	[('lang', 'ADJ'), ('mogelijk', 'ADJ'), ('uitstellen', 'VERB'), ('nederland', 'PROPN'), ('kloten', 'NOUN'), ('helpenspuiten', 'VERB'), ('heel', 'ADJ'), ('hard', 'ADJ'), ('ingrijpen', 'VERB'), ('mensen', 'NOUN'), ('luisteren', 'AUX'), ('nieuwe', 'ADJ'), ('gevangenissen', 'NOUN'), ('bouwen', 'VERB'), ('luisterende', 'VERB'), ('mensen', 'NOUN'), ('opsluiten', 'VERB')]
1	530	1	4392439134104944_4392712557410935	data	fetched (200)	2021-02-10	Facebook:/<post-id>/comments	Joop Nieuwenhuizen te druk met zakken vullen	2020-12-30	0.0	0.0	0.0	0.0	0.0	0.0	0.0	-0.2333333333333333	0.7666666666666666	joop nieuwenhuizen druk zakken vullen	[('joop', 'PROPN'), ('nieuwenhuizen', 'PROPN'), ('druk', 'ADJ'), ('zakken', 'NOUN'), ('vullen', 'VERB')]
1	531	1	4392439134104944_4392712957410895	data	fetched (200)	2021-02-10	Facebook:/<post-id>/comments	Anita Roskam positief hoeft geen klachten te geven, je bent dan wel verspreider.  	2020-12-30	0.0	4.0	0.0	0.0	0.0	0.0	0.0	0.3	0.39999999999999997	anita roskam positief hoeft klachten geven bent wel verspreider  	[('anita', 'PROPN'), ('roskam', 'PROPN'), ('positief', 'ADJ'), ('hoeft', 'AUX'), ('klachten', 'NOUN'), ('geven', 'VERB'), ('bent', 'AUX'), ('wel', 'ADV'), ('verspreider', 'ADJ'), (' ', 'SPACE')]
1	532	1	4392439134104944_4392713860744138	data	fetched (200)	2021-02-10	Facebook:/<post-id>/comments	Het vaccin voorkomt  niet per defenitie dat je beschermt bent en voorkomt niet dat je andere  besmet..........	2020-12-30	0.0	0.0	0.0	0.0	0.0	0.0	0.0	-0.2	0.4	vaccin voorkomt   per defenitie beschermt bent voorkomt   besmet	[('vaccin', 'NOUN'), ('voorkomt', 'AUX'), (' ', 'SPACE'), ('per', 'ADP'), ('defenitie', 'NOUN'), ('beschermt', 'AUX'), ('bent', 'AUX'), ('voorkomt', 'AUX'), (' ', 'SPACE'), ('besmet', 'ADP')]
1	534	1	4392439134104944_4392716690743855	data	fetched (200)	2021-02-10	Facebook:/<post-id>/comments	Steffan Reefman ja precies incompetent stelletje daar in Den Haag	2020-12-30	0.0	1.0	0.0	0.0	0.0	0.0	0.0	0.4	0.6	steffan reefman precies incompetent stelletje den haag	[('steffan', 'PROPN'), ('reefman', 'NOUN'), ('precies', 'ADJ'), ('incompetent', 'AUX'), ('stelletje', 'NOUN'), ('den', 'PROPN'), ('haag', 'PROPN')]
1	535	1	4392439134104944_4392718914076966	data	fetched (200)	2021-02-10	Facebook:/<post-id>/comments	🌏	2020-12-30	0.0	0.0	0.0	0.0	0.0	0.0	0.0	0.0	0.0	🌏	[('🌏', 'PROPN')]
1	536	1	4392439134104944_4392720364076821	data	fetched (200)	2021-02-10	Facebook:/<post-id>/comments	gommers kuipers voor het gerecht	2020-12-30	0.0	0.0	0.0	0.0	0.0	0.0	0.0	0.0	0.0	gommers kuipers gerecht	[('gommers', 'NOUN'), ('kuipers', 'NOUN'), ('gerecht', 'NOUN')]
1	537	1	4392439134104944_4392727720742752	data	fetched (200)	2021-02-10	Facebook:/<post-id>/comments	Ria Driessen Angst neemt duidelijk de overhand bij je.. Laat je niet zulke gekke dingen aanpraten,  is echt niet nodig.. 💛	2020-12-30	0.0	0.0	0.0	0.0	0.0	0.0	1.0	0.2152777777777778	0.6472222222222223	ria driessen angst neemt duidelijk overhand laat zulke gekke dingen aanpraten   echt nodig 💛	[('ria', 'PROPN'), ('driessen', 'PROPN'), ('angst', 'PROPN'), ('neemt', 'AUX'), ('duidelijk', 'ADJ'), ('overhand', 'NOUN'), ('laat', 'VERB'), ('zulke', 'DET'), ('gekke', 'ADJ'), ('dingen', 'NOUN'), ('aanpraten', 'AUX'), (' ', 'SPACE'), ('echt', 'ADJ'), ('nodig', 'ADJ'), ('💛', 'NOUN')]
1	538	1	4392439134104944_4392730670742457	data	fetched (200)	2021-02-10	Facebook:/<post-id>/comments	Beste mensen, Zodra een politicus zegt loempia's zijn gezond maar zelf niet eet dan weet je dat er iets is en de loempia niet deugd!! En dit geld ook voor de vac cin. kijk goed hier naar aub. waarom nemen politici niet de vaccin maar doen zij alsof? kijk naar filmpje als je ogen nog goed werken!!! https://twitter.com/i/status/1344409051317362690	2020-12-30	0.0	1.0	0.0	0.0	0.0	0.0	0.0	0.28437500000000004	0.8625000000000002	beste mensen zodra politicus zegt loempias gezond eet weet loempia deugd geld vac cin kijk goed aub waarom nemen politici vaccin alsof kijk filmpje ogen goed werken	[('beste', 'ADJ'), ('mensen', 'NOUN'), ('zodra', 'SCONJ'), ('politicus', 'NOUN'), ('zegt', 'AUX'), ('loempias', 'ADP'), ('gezond', 'ADJ'), ('eet', 'VERB'), ('weet', 'VERB'), ('loempia', 'PROPN'), ('deugd', 'NOUN'), ('geld', 'NOUN'), ('vac', 'NOUN'), ('cin', 'PROPN'), ('kijk', 'VERB'), ('goed', 'ADJ'), ('aub', 'PROPN'), ('waarom', 'ADV'), ('nemen', 'VERB'), ('politici', 'NOUN'), ('vaccin', 'NOUN'), ('alsof', 'SCONJ'), ('kijk', 'VERB'), ('filmpje', 'NOUN'), ('ogen', 'NOUN'), ('goed', 'ADJ'), ('werken', 'VERB')]
1	539	1	4392439134104944_4392731040742420	data	fetched (200)	2021-02-10	Facebook:/<post-id>/comments	Nederland slaat modderfiguur in Europa m.b.t. het vaccinatiebeleid. Kan die Hugo de Jonge niet ergens schoenen gaan verkopen?	2020-12-30	0.0	4.0	0.0	0.0	0.0	0.0	0.0	0.1	0.4	nederland slaat modderfiguur europa mbt vaccinatiebeleid hugo jonge ergens schoenen gaan verkopen	[('nederland', 'PROPN'), ('slaat', 'AUX'), ('modderfiguur', 'NOUN'), ('europa', 'PROPN'), ('mbt', 'NOUN'), ('vaccinatiebeleid', 'NOUN'), ('hugo', 'NOUN'), ('jonge', 'NOUN'), ('ergens', 'ADV'), ('schoenen', 'NOUN'), ('gaan', 'VERB'), ('verkopen', 'VERB')]
1	540	1	4392439134104944_4392732224075635	data	fetched (200)	2021-02-10	Facebook:/<post-id>/comments	Stemmen Vanuit Het Proletariaat heerlijk dat zootje dat in Den Jaag de dienst uitmaakt. 	2020-12-30	0.0	0.0	0.0	0.0	0.0	0.0	0.0	0.0	0.7	stemmen vanuit proletariaat heerlijk zootje den jaag dienst uitmaakt	[('stemmen', 'NOUN'), ('vanuit', 'ADP'), ('proletariaat', 'NOUN'), ('heerlijk', 'ADJ'), ('zootje', 'NOUN'), ('den', 'DET'), ('jaag', 'PROPN'), ('dienst', 'NOUN'), ('uitmaakt', 'AUX')]
1	541	1	4392439134104944_4392737494075108	data	fetched (200)	2021-02-10	Facebook:/<post-id>/comments	Ja waarom niet, de vaccins zijn er, start dan ook meteen!	2020-12-31	0.0	0.0	0.0	0.0	0.0	0.0	0.0	0.0	0.0	waarom vaccins start meteen	[('waarom', 'ADV'), ('vaccins', 'NOUN'), ('start', 'VERB'), ('meteen', 'ADV')]
1	542	1	4392439134104944_4392742897407901	data	fetched (200)	2021-02-10	Facebook:/<post-id>/comments	Jeroen Deschain  Er zit op het moment 1 filosoof in de 2e kamer. Ronald van Raak.	2020-12-31	0.0	0.0	0.0	0.0	0.0	0.0	0.0	0.4	0.65	jeroen deschain   zit moment 1 filosoof 2e kamer ronald raak	[('jeroen', 'PROPN'), ('deschain', 'PROPN'), (' ', 'SPACE'), ('zit', 'VERB'), ('moment', 'NOUN'), ('1', 'NUM'), ('filosoof', 'NOUN'), ('2e', 'ADJ'), ('kamer', 'NOUN'), ('ronald', 'VERB'), ('raak', 'NOUN')]
1	543	1	4392439134104944_4392743050741219	data	fetched (200)	2021-02-10	Facebook:/<post-id>/comments	Christiaan Wierenga zal ik het nog een keer uitleggen Haha?	2020-12-31	0.0	0.0	0.0	0.0	0.0	0.0	0.0	0.0	0.0	christiaan wierenga keer uitleggen haha	[('christiaan', 'PROPN'), ('wierenga', 'PROPN'), ('keer', 'NOUN'), ('uitleggen', 'NOUN'), ('haha', 'PROPN')]
1	544	1	4392439134104944_4392744250741099	data	fetched (200)	2021-02-10	Facebook:/<post-id>/comments	Millicent Kamperveen met oogkleppen	2020-12-31	0.0	1.0	0.0	0.0	0.0	0.0	0.0	0.0	0.0	millicent kamperveen oogkleppen	[('millicent', 'PROPN'), ('kamperveen', 'PROPN'), ('oogkleppen', 'NOUN')]
1	545	1	4392439134104944_4392745534074304	data	fetched (200)	2021-02-10	Facebook:/<post-id>/comments	Het probleem met de verzorgingsstaat was dat ze onbetaalbaar was. Als de gasbel onder slochteren niet gevonden was, waren we failliet gegaan.	2020-12-31	0.0	0.0	0.0	0.0	0.0	0.0	0.0	-0.3	0.5	probleem verzorgingsstaat onbetaalbaar gasbel slochteren gevonden we failliet gegaan	[('probleem', 'NOUN'), ('verzorgingsstaat', 'NOUN'), ('onbetaalbaar', 'ADJ'), ('gasbel', 'NOUN'), ('slochteren', 'NOUN'), ('gevonden', 'VERB'), ('we', 'PRON'), ('failliet', 'ADJ'), ('gegaan', 'VERB')]
1	546	1	4392439134104944_4392746624074195	data	fetched (200)	2021-02-10	Facebook:/<post-id>/comments	Goed idee. Begin met het verplegend personeel en de artsen. 	2020-12-31	0.0	0.0	0.0	0.0	0.0	0.0	0.0	0.55	0.9	goed idee begin verplegend personeel artsen	[('goed', 'ADJ'), ('idee', 'NOUN'), ('begin', 'NOUN'), ('verplegend', 'VERB'), ('personeel', 'NOUN'), ('artsen', 'NOUN')]
1	547	1	4392439134104944_4392748767407314	data	fetched (200)	2021-02-10	Facebook:/<post-id>/comments	Steffan Reefman  Je kan heel veel voorbereiden, maar zonder uiteindelijke datum kan je de boel niet volledig plannen. Je kan niet een priklokatie vast 3 maanden van tevoren gaan reserveren, als je niet precies weet wanneer je hem nodig hebt. Je kan niet het personeel vast maanden van tevoren gaan huren etc. 	2020-12-31	0.0	1.0	0.0	0.0	0.0	0.0	0.0	0.019047619047619042	0.37857142857142856	steffan reefman   heel voorbereiden uiteindelijke datum boel volledig plannen priklokatie vast 3 maanden tevoren gaan reserveren precies weet wanneer nodig hebt personeel vast maanden tevoren gaan huren etc	[('steffan', 'PROPN'), ('reefman', 'NOUN'), (' ', 'SPACE'), ('heel', 'ADJ'), ('voorbereiden', 'NOUN'), ('uiteindelijke', 'ADJ'), ('datum', 'NOUN'), ('boel', 'NOUN'), ('volledig', 'ADJ'), ('plannen', 'AUX'), ('priklokatie', 'NOUN'), ('vast', 'ADJ'), ('3', 'NUM'), ('maanden', 'NOUN'), ('tevoren', 'ADV'), ('gaan', 'VERB'), ('reserveren', 'VERB'), ('precies', 'ADJ'), ('weet', 'VERB'), ('wanneer', 'SCONJ'), ('nodig', 'ADJ'), ('hebt', 'AUX'), ('personeel', 'NOUN'), ('vast', 'ADJ'), ('maanden', 'NOUN'), ('tevoren', 'ADV'), ('gaan', 'VERB'), ('huren', 'VERB'), ('etc', 'PROPN')]
1	548	1	4392439134104944_4392750244073833	data	fetched (200)	2021-02-10	Facebook:/<post-id>/comments	Neuuuu	2020-12-31	0.0	0.0	0.0	0.0	0.0	0.0	0.0	0.0	0.0	neuuuu	[('neuuuu', 'NOUN')]
1	549	1	4392439134104944_4392752997406891	data	fetched (200)	2021-02-10	Facebook:/<post-id>/comments	Appy Axl Iron doe normaal man	2020-12-31	0.0	0.0	0.0	0.0	0.0	0.0	0.0	0.1	0.6	appy axl iron doe normaal man	[('appy', 'ADJ'), ('axl', 'PROPN'), ('iron', 'PROPN'), ('doe', 'VERB'), ('normaal', 'ADJ'), ('man', 'NOUN')]
1	550	1	4392439134104944_4392753977406793	data	fetched (200)	2021-02-10	Facebook:/<post-id>/comments	Anne Verbeek  Of je was gewoon lange tijd doodziek. Correlatie is geen causatie.	2020-12-31	0.0	1.0	0.0	0.0	0.0	0.0	0.0	-0.39999999999999997	0.75	anne verbeek   gewoon lange tijd doodziek correlatie causatie	[('anne', 'PROPN'), ('verbeek', 'AUX'), (' ', 'SPACE'), ('gewoon', 'ADJ'), ('lange', 'ADJ'), ('tijd', 'NOUN'), ('doodziek', 'NOUN'), ('correlatie', 'NOUN'), ('causatie', 'NOUN')]
1	551	1	4392439134104944_4392754797406711	data	fetched (200)	2021-02-10	Facebook:/<post-id>/comments	Ramon Pascal blijkbaar heeft niet iedereen humor🤣	2020-12-31	0.0	0.0	0.0	1.0	0.0	0.0	0.0	0.0	0.6	ramon pascal blijkbaar iedereen humor 🤣	[('ramon', 'NOUN'), ('pascal', 'NOUN'), ('blijkbaar', 'ADJ'), ('iedereen', 'PRON'), ('humor', 'NOUN'), ('🤣', 'NUM')]
